{
  "task_id": "b03-strike-it-rich-flashback-20260513",
  "status": "success",
  "summary": "Fixed graveyard flashback action generation so Strike It Rich only generates flashback cast actions from graveyard, preserving the sorcery-speed stack gate and avoiding normal hand-cast actions from graveyard. Added focused Strike It Rich tests covering insufficient mana, flashback-only action generation, and exile-on-resolution behavior.",
  "files_changed": [
    "mtg_sim/sim/action_generator.py",
    "mtg_sim/tests/test_misc_spells.py"
  ],
  "validation_results": [
    {
      "command": "python3 -m pytest mtg_sim/tests/test_misc_spells.py -k strike_it_rich -q -W ignore::UserWarning",
      "exit_code": 0,
      "stdout": "...                                                                      [100%]\n3 passed, 47 deselected in 0.05s\n",
      "stderr": ""
    },
    {
      "command": "python3 -m pytest mtg_sim/tests/ -q -W ignore::UserWarning",
      "exit_code": 0,
      "stdout": "........................................................................ [ 17%]\n........................................................................ [ 34%]\n........................................................................ [ 51%]\n........................................................................ [ 68%]\n........................................................................ [ 85%]\n...........................................................              [100%]\n419 passed in 1.62s\n",
      "stderr": ""
    }
  ],
  "issues": [],
  "proposed_followup_tasks": [],
  "completed_at": "2026-05-13T22:45:34-07:00"
}
